{
  "kind": "cineweave_codex_asset_alias_registry",
  "contractVersion": "2.5.0",
  "assetAliasRegistryId": "alias-registry.rain-courtyard-v1",
  "version": 1,
  "status": "active",
  "scope": {
    "scopeType": "sequence",
    "scopeId": "sequence.rain-courtyard-recognition-v1",
    "targetContractKinds": [
      "character_binding",
      "scene_binding",
      "cineweave_codex_reference_asset"
    ]
  },
  "aliases": [
    {
      "alias": "@沈蘅",
      "normalizedAlias": "@沈蘅",
      "targetRef": {
        "kind": "character_binding",
        "id": "binding.gu-yin-courtyard-01",
        "version": 1,
        "contentHash": "sha256:aaaaaaaaaaaaaaaaaaaaaaaaaaaaaaaaaaaaaaaaaaaaaaaaaaaaaaaaaaaaaaaa"
      },
      "role": "character",
      "status": "resolved",
      "description": "已经锁定的主角色精确 CharacterBinding。"
    },
    {
      "alias": "@临安.御街.雨夜",
      "normalizedAlias": "@临安.御街.雨夜",
      "targetRef": {
        "kind": "scene_binding",
        "id": "binding.scene-rain-courtyard-01",
        "version": 1,
        "contentHash": "sha256:bbbbbbbbbbbbbbbbbbbbbbbbbbbbbbbbbbbbbbbbbbbbbbbbbbbbbbbbbbbbbbbb"
      },
      "role": "scene",
      "status": "resolved",
      "description": "已经锁定的雨夜庭院空间与地理关系。"
    },
    {
      "alias": "@青玉剑",
      "normalizedAlias": "@青玉剑",
      "targetRef": {
        "kind": "cineweave_codex_reference_asset",
        "id": "reference.prop.jade-sword-01",
        "version": 1,
        "contentHash": "sha256:cccccccccccccccccccccccccccccccccccccccccccccccccccccccccccccccc"
      },
      "role": "prop",
      "status": "resolved",
      "description": "只作为道具外观证据，不把别名升级为动作或身份事实。"
    }
  ],
  "collisionPolicy": {
    "aliasUniqueness": "reject",
    "canonicalization": "unicode_nfc_exact",
    "unresolvedAlias": "request_explicit_binding"
  },
  "resolutionPolicy": {
    "mode": "declared_map_only",
    "exactRefsOnly": true,
    "allowLatest": false,
    "inferFromPrompt": false,
    "crossScopeResolution": false,
    "executesProvider": false
  },
  "skillReceipt": {
    "repository": "https://github.com/Wilder1222/cineweave-director",
    "ref": "v3.1.0",
    "commit": "0123456789abcdef0123456789abcdef01234567",
    "installedBy": "codex-environment",
    "usedAt": "2026-09-02T04:10:00.000Z"
  },
  "planningBoundary": {
    "providerNeutral": true,
    "resolvesReferencesOnly": true,
    "generatesMedia": false,
    "invokesExternalTool": false,
    "mutatesCanon": false,
    "writesFiles": false,
    "humanApprovalRequired": true,
    "notes": "别名只展开为声明过的精确合同引用；未知别名必须阻塞或请求显式绑定。"
  },
  "validation": {
    "aliasesUnique": true,
    "aliasesNfcNormalized": true,
    "exactTargetRefs": true,
    "noLatestResolution": true,
    "noInference": true,
    "noProviderSyntax": true,
    "noPrivateLocators": true,
    "noCanonMutation": true,
    "noExternalExecution": true
  },
  "provenance": {
    "source": "codex_authored",
    "createdAt": "2026-09-02T04:10:00.000Z",
    "updatedAt": "2026-09-02T04:10:00.000Z",
    "changeLog": [
      "v1: scoped @Asset aliases resolve only to exact immutable contract refs"
    ]
  }
}
